{
  "validator_name": "linear_vesting.linear_vesting.spend",
  "source_repository": "https://github.com/input-output-hk/contracts-library",
  "source_commit": "d629dce7ef1a6af883215c076adc964bd37152a1",
  "file_name": "onchain/validators/linear_vesting.ak",
  "sha256": "2c15cb59b3f51447563d1da375d39f5c5ecf8db677c3460ae74c9edd2826299e",
  "cbor_hex": "59057901010029800aba2aba1aba0aab9faab9eaab9dab9a488888896600264653001300800198041804800cdc3a400530080024888966002600460106ea800e2653001300d00198069807000cdc3a400091119912cc004c00c0062b3001300f37540150028b20208acc004c0200062b3001300f37540150028b20208b201a40342b30013001300c375400519800980818069baa0029112cc004c010c03cdd5001c4c8c8cc004004010896600200314a115980099b8f375c602c00200714a31330020023017001404480a0dd7180998081baa00389919800800801112cc00400629422b30013375e00a6022602a00314a313300200230160014040809900e48c044c048c048c04800646022602460246024602400323011301200148888966002600c60226ea8036264b300130073012375400319800912cc0040062900044cdc02400466004004603200280b244646600200200644b30010018a518acc004c00cc068006266004004603600314a080a901848c05cc060c060006600460266ea8c058c04cdd5000cc04cdd5005a4444464646644b30019800980f980e1baa00f9bac301f30200029bab301f003403915980099b88375a601a60386ea803cdd69806180e1baa00f8992cc004c058c070dd5000c56600266e1d2004301c37546010603a6ea801e330013758604000d3758604000b3020301d37546040603a6ea801e6eb4c080c074dd5000a444464b3001337126eb4c048c088dd500a8014528c56600266e24c8c8cc00400401c896600200314800226644b30015980099baf302a302737546054604e6ea8c058c09cdd500100444cdd7980918139baa30163027375400400b14a0812a266e0120020018800a04a30280013300200230290014098601a60446ea8030c01c00626601c00246601e6eb0c038c08cdd500b119b89337026eb4c03cc090dd5000cc004dd6980798121baa0019bad30153024375402f375a602860486ea805d2225980099b890070028a400115980099b890010078801c4cdc199b820033370200e00466e04004009025204a4c004dd5980998121baa0029bae302730243754003375c602660486ea8006290002444466446600200200464646600200200c44b3001001801c4c8c96600266e440200062b30013371e01000313756605a00500540ad133004004303100340ac6eb8c0ac004c0b800502c0a5eb7bdb1808966002003003899192cc004cdc8803000c56600266e3c01800626eb4c0b000a00a815226600800860600068150dd718150009816800a056452820404080646600200200844b30010018a5eb8226644b30015980099baf3028302537546050604a6ea800801a266ebcc040c094dd5001180818129baa00f8a50408d13302700233004004001899802002000a0463026001302700140908b20368b2036301f301c3754603e60386ea8c07c00a2c80d22c80d0c078004c01c01cc074c074c074c074004c070c07000516404464660020026eb0c058c04cdd5005912cc0040062980103d87a80008992cc004cdd7980c180a9baa00100b899ba548000cc05c0052f5c11330030033019002404c602e00280aa2646644b300198009802180a9baa0089bac301830190029bab3018003401d15980099b88375a600c602a6ea8020dd69802980a9baa0088acc004cdc41bad3005301537540106eb4c004c054dd500444c8c8cc89660026024005132598009809980c9baa3009301a3754603a60346ea8016266e20008006266e240080050181bad301c30193754007159800980680145284528a02e405c602c6ea8004dd69801980b9baa00a3019301637546032602c6ea8004c06000a2c809a2c809a2c8098c05c0048c05cc060c060c060c060c060004c058c058c058c058c058c058c048dd5005202045900b18061baa00818049baa0038b200e180400098019baa0088a4d13656400401",
  "cbor_format": "single_cbor_hex",
  "plutus_version": "v3",
  "parameterization_state": "unparameterized",
  "applied_parameters": [],
  "compiler_name": "Aiken",
  "compiler_version": "v1.1.22+39d6b04"
}
